Unnamed: 0,DOI,Author,Title,Year,Journal,source,PubMedID,Group,Title_lower,Journal_lower,Count,Label_ID,Label,Malik_Label_Validation,Jodi_Label_Validation,Remark,Retraction_Phrase,Inference Possibility,Inference Number,Retraction_Flag,Retraction_Flag_Pos
396,10.1016/s0140-6736(16)30002-2,"[{'given': 'Bruno R', 'family': 'da Costa', 'sequence': 'first', 'affiliation': []}, {'given': 'Stephan', 'family': 'Reichenbach', 'sequence': 'additional', 'affiliation': []}, {'given': 'Noah', 'family': 'Keller', 'sequence': 'additional', 'affiliation': []}, {'given': 'Linda', 'family': 'Nartey', 'sequence': 'additional', 'affiliation': []}, {'given': 'Simon', 'family': 'Wandel', 'sequence': 'additional', 'affiliation': []}, {'given': 'Peter', 'family': 'J√ºni', 'sequence': 'additional', 'affiliation': []}, {'given': 'Sven', 'family': 'Trelle', 'sequence': 'additional', 'affiliation': []}]",RETRACTED: Effectiveness of non-steroidal anti-inflammatory drugs for the treatment of pain in knee and hip osteoarthritis: a network meta-analysis,2016,The Lancet,Crossref,,likely_retracted,retracted: effectiveness of non-steroidal anti-inflammatory drugs for the treatment of pain in knee and hip osteoarthritis: a network meta-analysis,the lancet,1,RP259,retracted paper(rp),,,,retracted:,RP259-Y,1,retracted:,begin
397,10.1016/j.ajsep.2022.09.001,"[{'given': 'Ting-Hong', 'family': 'Chien', 'sequence': 'first', 'affiliation': []}, {'given': 'Jo-Yun', 'family': 'Chen', 'sequence': 'additional', 'affiliation': []}, {'given': 'Szu-Yu', 'family': 'Chen', 'sequence': 'additional', 'affiliation': []}, {'ORCID': 'http://orcid.org/0000-0002-7985-5719', 'authenticated-orcid': False, 'given': 'Li-Kang', 'family': 'Chi', 'sequence': 'additional', 'affiliation': []}]","RETRACTED: Effects of different PETTLEP imagery training methods on high school basketball players‚Äô jump-shot performance, self-confidence and anxiety",2022,Asian Journal of Sport and Exercise Psychology,Crossref,,likely_retracted,"retracted: effects of different pettlep imagery training methods on high school basketball players‚Äô jump-shot performance, self-confidence and anxiety",asian journal of sport and exercise psychology,1,RP18,retracted paper(rp),,,,retracted:,RP18-Y,1,retracted:,begin
399,10.1016/j.aquaculture.2018.06.082,"[{'given': 'Daruosh', 'family': 'Abdollahi-Arpanahi', 'sequence': 'first', 'affiliation': []}, {'given': 'Elahe', 'family': 'Soltani', 'sequence': 'additional', 'affiliation': []}, {'given': 'Hojatollah', 'family': 'Jafaryan', 'sequence': 'additional', 'affiliation': []}, {'given': 'Mehdi', 'family': 'Soltani', 'sequence': 'additional', 'affiliation': []}, {'given': 'Mahsa', 'family': 'Naderi-Samani', 'sequence': 'additional', 'affiliation': []}, {'given': 'Angel Isidro', 'family': 'Campa-C√≥rdova', 'sequence': 'additional', 'affiliation': []}]","RETRACTED: Efficacy of two commercial and indigenous probiotics, Bacillus subtilis and Bacillus licheniformis on growth performance, immuno-physiology and resistance response of juvenile white shrimp (Litopenaeus vannamei)",2018,Aquaculture,Crossref,,likely_retracted,"retracted: efficacy of two commercial and indigenous probiotics, bacillus subtilis and bacillus licheniformis on growth performance, immuno-physiology and resistance response of juvenile white shrimp (litopenaeus vannamei)",aquaculture,1,RP12,retracted paper(rp),,,,retracted:,RP12-Y,1,retracted:,begin
400,10.1016/j.sbsr.2018.06.002,"[{'given': 'Jihane', 'family': 'El Mastour', 'sequence': 'first', 'affiliation': []}, {'given': 'Salah Eddine', 'family': 'El Qouatli', 'sequence': 'additional', 'affiliation': []}, {'given': 'Abdelilah', 'family': 'Chtaini', 'sequence': 'additional', 'affiliation': []}]",RETRACTED: Electrochemical chelation and reduction of nitrate ion on EDTA modified carbon paste electrode,2018,Sensing and Bio-Sensing Research,Crossref,,likely_retracted,retracted: electrochemical chelation and reduction of nitrate ion on edta modified carbon paste electrode,sensing and bio-sensing research,1,RP243,retraction notice(rn),,,,retracted:,RP243-Y,1,retracted:,begin
402,10.1016/j.physb.2020.412413,"[{'given': 'A.', 'family': 'Hamodi', 'sequence': 'first', 'affiliation': []}, {'given': 'Tuncer', 'family': 'H√∂kelek', 'sequence': 'additional', 'affiliation': []}, {'given': 'Y.I.', 'family': 'Hamodi', 'sequence': 'additional', 'affiliation': []}, {'given': 'N.B.', 'family': 'Mahmood', 'sequence': 'additional', 'affiliation': []}, {'ORCID': 'http://orcid.org/0000-0003-1796-2882', 'authenticated-orcid': False, 'given': 'K.K.', 'family': 'Naji', 'sequence': 'additional', 'affiliation': []}]",RETRACTED: Electronic structure of epitaxially grown chromium-doped Bi2Te3 films,2020,Physica B: Condensed Matter,Crossref,,likely_retracted,retracted: electronic structure of epitaxially grown chromium-doped bi2te3 films,physica b: condensed matter,1,RP220,retracted paper(rp),,,,retracted:,RP220-Y,1,retracted:,begin
408,10.1016/s1872-2067(16)62489-0,"[{'given': 'Jing', 'family': 'Huang', 'sequence': 'first', 'affiliation': []}, {'given': 'Yan', 'family': 'Iuo', 'sequence': 'additional', 'affiliation': []}, {'given': 'Jiali', 'family': 'Cai', 'sequence': 'additional', 'affiliation': []}]",RETRACTED: Enantioselective epoxidation of unfunctionalized olefins by Jacobsen's catalyst immobilized on amino-modified ZnPS-PVPA,2016,Chinese Journal of Catalysis,Crossref,,likely_retracted,retracted: enantioselective epoxidation of unfunctionalized olefins by jacobsen's catalyst immobilized on amino-modified znps-pvpa,chinese journal of catalysis,1,RP48,both_rp_rn,,,,retracted:,RP48-Y,1,retracted:,begin
412,10.1016/j.sandf.2014.06.003,"[{'given': 'Y.', 'family': 'Hata', 'sequence': 'first', 'affiliation': []}, {'given': 'K.', 'family': 'Ichii', 'sequence': 'additional', 'affiliation': []}, {'given': 'A.', 'family': 'Nozu', 'sequence': 'additional', 'affiliation': []}, {'given': 'Y.', 'family': 'Maruyama', 'sequence': 'additional', 'affiliation': []}, {'given': 'H.', 'family': 'Sakai', 'sequence': 'additional', 'affiliation': []}]","RETRACTED: Evaluation of strong ground motion at Imagawa, Urayasu City, during the 2011 off the Pacific coast of Tohoku Earthquake",2014,Soils and Foundations,Crossref,,likely_retracted,"retracted: evaluation of strong ground motion at imagawa, urayasu city, during the 2011 off the pacific coast of tohoku earthquake",soils and foundations,1,RP246,both_rp_rn,,,,retracted:,RP246-Y,1,retracted:,begin
414,10.1016/j.trd.2017.06.012,"[{'given': 'T.', 'family': 'Lakshmanan', 'sequence': 'first', 'affiliation': []}, {'given': 'A.', 'family': 'Avinash', 'sequence': 'additional', 'affiliation': []}, {'given': 'G.', 'family': 'Nagarajan', 'sequence': 'additional', 'affiliation': []}]",RETRACTED: Experimental study on DI diesel engine with acetylene in dual fuel mode with DEE as an ignition enhancer,2017,Transportation Research Part D: Transport and Environment,Crossref,,likely_retracted,retracted: experimental study on di diesel engine with acetylene in dual fuel mode with dee as an ignition enhancer,transportation research part d: transport and environment,1,RP267,both_rp_rn,,,,retracted:,RP267-Y,1,retracted:,begin
417,10.1016/j.optmat.2022.112225,"[{'given': 'Zhe', 'family': 'Chen', 'sequence': 'first', 'affiliation': []}, {'given': 'Xiangyong', 'family': 'Wang', 'sequence': 'additional', 'affiliation': []}, {'given': 'Jun', 'family': 'Wang', 'sequence': 'additional', 'affiliation': []}, {'given': 'Chao', 'family': 'Yang', 'sequence': 'additional', 'affiliation': []}]",RETRACTED: Fabrication and characterizations of a Gadolinium doped terbium gallium garnet crystal for Faraday rotators,2022,Optical Materials,Crossref,,likely_retracted,retracted: fabrication and characterizations of a gadolinium doped terbium gallium garnet crystal for faraday rotators,optical materials,1,RP210,retracted paper(rp),,,,retracted:,RP210-Y,1,retracted:,begin
418,10.1016/j.engfailanal.2014.02.017,"[{'ORCID': 'http://orcid.org/0000-0001-7950-7733', 'authenticated-orcid': False, 'given': 'Mahdi', 'family': 'Shariati', 'sequence': 'first', 'affiliation': []}, {'given': 'Ali', 'family': 'Shariati', 'sequence': 'additional', 'affiliation': []}, {'given': 'N.H.', 'family': 'Ramli Sulong', 'sequence': 'additional', 'affiliation': []}, {'given': 'Meldi', 'family': 'Suhatril', 'sequence': 'additional', 'affiliation': []}, {'given': 'M.M.', 'family': 'Arabnejad Khanouki', 'sequence': 'additional', 'affiliation': []}]",RETRACTED: Fatigue energy dissipation and failure analysis of angle shear connectors embedded in high strength concrete,2014,Engineering Failure Analysis,Crossref,,likely_retracted,retracted: fatigue energy dissipation and failure analysis of angle shear connectors embedded in high strength concrete,engineering failure analysis,1,RP77,retracted paper(rp),,,,retracted:,RP77-Y,1,retracted:,begin
420,10.1016/j.bbrc.2019.02.156,"[{'given': 'Jiang-Long', 'family': 'Du', 'sequence': 'first', 'affiliation': []}, {'ORCID': 'http://orcid.org/0000-0003-3459-7207', 'authenticated-orcid': False, 'given': 'Xin', 'family': 'Cao', 'sequence': 'additional', 'affiliation': []}, {'given': 'Han-Yu', 'family': 'Liu', 'sequence': 'additional', 'affiliation': []}, {'given': 'Yan', 'family': 'Zeng', 'sequence': 'additional', 'affiliation': []}, {'given': 'Xue-Cai', 'family': 'Yang', 'sequence': 'additional', 'affiliation': []}, {'given': 'Xue-Mei', 'family': 'Wan', 'sequence': 'additional', 'affiliation': []}, {'given': 'Fan-Fan', 'family': 'Chang', 'sequence': 'additional', 'affiliation': []}, {'given': 'Tian-Yu', 'family': 'Zhao', 'sequence': 'additional', 'affiliation': []}, {'given': 'Xiao-Ye', 'family': 'Jia', 'sequence': 'additional', 'affiliation': []}, {'given': 'Hai-Zhen', 'family': 'Wang', 'sequence': 'additional', 'affiliation': []}, {'given': 'Jing', 'family': 'Liu', 'sequence': 'additional', 'affiliation': []}, {'given': 'Kui-Zheng', 'family': 'Cai', 'sequence': 'additional', 'affiliation': []}, {'given': 'Zhong-Ren', 'family': 'Ma', 'sequence': 'additional', 'affiliation': []}]",RETRACTED: Function of the PLZF gene in early development and self-renewal of T¬†cells in mice,2019,Biochemical and Biophysical Research Communications,Crossref,,likely_retracted,retracted: function of the plzf gene in early development and self-renewal of t¬†cells in mice,biochemical and biophysical research communications,1,RP24,both_rp_rn,,agree,,retracted:,RP24-Y,1,retracted:,begin
422,10.1016/j.gaost.2019.09.005,"[{'given': 'Balasubramaniam Jaya', 'family': 'Prasad', 'sequence': 'first', 'affiliation': []}, {'given': 'Pazhaniyandi Subramania', 'family': 'Sharavanan', 'sequence': 'additional', 'affiliation': []}, {'given': 'Rengaraj', 'family': 'Sivaraj', 'sequence': 'additional', 'affiliation': []}]",RETRACTED: Health benefits of black rice ‚Äì A review,2019,Grain &amp; Oil Science and Technology,Crossref,,likely_retracted,retracted: health benefits of black rice ‚Äì a review,grain &amp; oil science and technology,1,RP97,retracted paper(rp),,,,retracted:,RP97-Y,1,retracted:,begin
423,10.1016/j.clnu.2020.08.028,"[{'ORCID': 'http://orcid.org/0000-0002-2979-9819', 'authenticated-orcid': False, 'given': 'Gustavo D.', 'family': 'Pimentel', 'sequence': 'first', 'affiliation': []}, {'ORCID': 'http://orcid.org/0000-0003-4978-6385', 'authenticated-orcid': False, 'given': 'Claude', 'family': 'Pichard', 'sequence': 'additional', 'affiliation': []}, {'ORCID': 'http://orcid.org/0000-0002-9809-3553', 'authenticated-orcid': False, 'given': 'Alessandro', 'family': 'Laviano', 'sequence': 'additional', 'affiliation': []}, {'given': 'Renata C.', 'family': 'Fernandes', 'sequence': 'additional', 'affiliation': []}]",RETRACTED: High protein diet improves the overall survival in older adults with advanced gastrointestinal cancer,2021,Clinical Nutrition,Crossref,,likely_retracted,retracted: high protein diet improves the overall survival in older adults with advanced gastrointestinal cancer,clinical nutrition,1,RP50,retracted paper(rp),,,,retracted:,RP50-Y,1,retracted:,begin
427,10.1016/j.elerap.2018.01.008,"[{'given': 'Lu', 'family': 'Wang', 'sequence': 'first', 'affiliation': []}, {'given': 'Minxue', 'family': 'Huang', 'sequence': 'additional', 'affiliation': []}, {'given': 'Maohong', 'family': 'Liu', 'sequence': 'additional', 'affiliation': []}]",RETRACTED: How the founders‚Äô social capital affects the success of open-source projects: A resource-based view of project teams,2018,Electronic Commerce Research and Applications,Crossref,,likely_retracted,retracted: how the founders‚Äô social capital affects the success of open-source projects: a resource-based view of project teams,electronic commerce research and applications,1,RP73,both_rp_rn,,,,retracted:,RP73-Y,1,retracted:,begin
430,10.1016/j.amjmed.2014.07.001,"[{'given': 'George', 'family': 'Mansour', 'sequence': 'first', 'affiliation': []}, {'given': 'Ahmad', 'family': 'Abuzaid', 'sequence': 'additional', 'affiliation': []}, {'given': 'Pallavi', 'family': 'Bellamkonda', 'sequence': 'additional', 'affiliation': []}]",RETRACTED: I Do Not Even Remember What I Smoked! A Case of Marijuana-induced Transient Global Amnesia,2014,The American Journal of Medicine,Crossref,,likely_retracted,retracted: i do not even remember what i smoked! a case of marijuana-induced transient global amnesia,the american journal of medicine,1,RP254,retracted paper(rp),,,,retracted:,RP254-Y,1,retracted:,begin
431,10.1016/j.rhisph.2020.100268,"[{'given': 'Mohammad Zahangeer', 'family': 'Alam', 'sequence': 'first', 'affiliation': []}, {'given': 'Md Anamul', 'family': 'Hoque', 'sequence': 'additional', 'affiliation': []}, {'given': 'Lynne', 'family': 'Carpenter-Boggs', 'sequence': 'additional', 'affiliation': []}]",RETRACTED: Identification of practical amendments to mitigate soil arsenic levels in peas,2020,Rhizosphere,Crossref,,likely_retracted,retracted: identification of practical amendments to mitigate soil arsenic levels in peas,rhizosphere,1,RP240,both_rp_rn,,,,retracted:,RP240-Y,1,retracted:,begin
432,10.1002/humu.24093,,Retracted: Identification of seven novel mutations in ABCD1 by a DHPLC‚Äêbased assay in Italian patients with X‚Äêlinked adrenoleukodystrophy,2020,Human Mutation,Crossref,,likely_retracted,retracted: identification of seven novel mutations in abcd1 by a dhplc‚Äêbased assay in italian patients with x‚Äêlinked adrenoleukodystrophy,human mutation,1,RP100,retraction notice(rn),,,,retracted:,RP100-Y,1,retracted:,begin
436,10.1016/j.mspro.2014.06.132,"[{'given': 'Ali Naem S.', 'family': 'Alamry', 'sequence': 'first', 'affiliation': []}, {'given': 'B. Gangadhara', 'family': 'Prusty', 'sequence': 'additional', 'affiliation': []}, {'given': 'Mykanth Reddy', 'family': 'Mada', 'sequence': 'additional', 'affiliation': []}, {'given': 'Sri', 'family': 'Bandyopadhyay', 'sequence': 'additional', 'affiliation': []}]",RETRACTED: Improved Crack Resistance and Fracture Toughness Using MWCNT Modified Epoxy for Delaminated Composite Structures,2014,Procedia Materials Science,Crossref,,likely_retracted,retracted: improved crack resistance and fracture toughness using mwcnt modified epoxy for delaminated composite structures,procedia materials science,1,RP231,both_rp_rn,,,,retracted:,RP231-Y,1,retracted:,begin
437,10.1016/j.acvdsp.2022.10.092,"[{'given': 'H.', 'family': 'Allaoui', 'sequence': 'first', 'affiliation': []}, {'given': 'M.', 'family': 'Naziha', 'sequence': 'additional', 'affiliation': []}, {'given': 'M.', 'family': 'Amor', 'sequence': 'additional', 'affiliation': []}, {'given': 'E.', 'family': 'Messadi', 'sequence': 'additional', 'affiliation': []}]","RETRACTED: In silico approaches for the design of a novel analog of Lebetin 2, has a better effect on the molecular mechanism of action in ischemia cardiology",2023,Archives of Cardiovascular Diseases Supplements,Crossref,,likely_retracted,"retracted: in silico approaches for the design of a novel analog of lebetin 2, has a better effect on the molecular mechanism of action in ischemia cardiology",archives of cardiovascular diseases supplements,1,RP15,retracted paper(rp),,,,retracted:,RP15-Y,1,retracted:,begin
439,10.1016/j.pmpp.2011.07.005,"[{'given': 'Mohamed I.', 'family': 'Kobeasy', 'sequence': 'first', 'affiliation': []}, {'given': 'Hossam S.', 'family': 'El-Beltagi', 'sequence': 'additional', 'affiliation': []}, {'given': 'Manal A.', 'family': 'El-Shazly', 'sequence': 'additional', 'affiliation': []}, {'given': 'Eman A.H.', 'family': 'Khattab', 'sequence': 'additional', 'affiliation': []}]",RETRACTED: Induction of resistance in Arachis hypogaea L. against Peanut mottle virus by nitric oxide and salicylic acid,2011,Physiological and Molecular Plant Pathology,Crossref,,likely_retracted,retracted: induction of resistance in arachis hypogaea l. against peanut mottle virus by nitric oxide and salicylic acid,physiological and molecular plant pathology,1,RP223,retracted paper(rp),,,,retracted:,RP223-Y,1,retracted:,begin
441,10.1016/j.jobe.2021.102556,"[{'given': 'Anwar', 'family': 'Hosan', 'sequence': 'first', 'affiliation': []}, {'given': 'Faiz Uddin Ahmed', 'family': 'Shaikh', 'sequence': 'additional', 'affiliation': []}]",RETRACTED: Influence of nano-CaCO3 addition on the compressive strength and microstructure of high volume slag and high volume slag-fly ash blended pastes,2022,Journal of Building Engineering,Crossref,,likely_retracted,retracted: influence of nano-caco3 addition on the compressive strength and microstructure of high volume slag and high volume slag-fly ash blended pastes,journal of building engineering,1,RP137,retraction notice(rn),,,,retracted:,RP137-Y,1,retracted:,begin
444,10.1177/09596518231165576,,RETRACTED: Integral backstepping control with RRFNN and MPSO of LPMSM drive system,2023,"Proceedings of the Institution of Mechanical Engineers, Part I: Journal of Systems and Control Engineering",Crossref,,likely_retracted,retracted: integral backstepping control with rrfnn and mpso of lpmsm drive system,"proceedings of the institution of mechanical engineers, part i: journal of systems and control engineering",1,RP233,retraction notice(rn),,,,retracted:,RP233-Y,1,retracted:,begin
452,10.1177/13694332231158882,,RETRACTED: Investigation of ductile fracture behavior of lap-welded joints with 460 MPa steel,2023,Advances in Structural Engineering,Crossref,,likely_retracted,retracted: investigation of ductile fracture behavior of lap-welded joints with 460 mpa steel,advances in structural engineering,1,RP2,retraction notice(rn),,,,retracted:,RP2-Y,1,retracted:,begin
456,10.1016/j.jddst.2020.101949,"[{'ORCID': 'http://orcid.org/0000-0001-9979-8945', 'authenticated-orcid': False, 'given': 'Tong', 'family': 'Zhang', 'sequence': 'first', 'affiliation': []}, {'given': 'Tianhui', 'family': 'Zhu', 'sequence': 'additional', 'affiliation': []}, {'given': 'Fanyin', 'family': 'Wang', 'sequence': 'additional', 'affiliation': []}, {'given': 'Ling', 'family': 'Peng', 'sequence': 'additional', 'affiliation': []}, {'given': 'Mingying', 'family': 'Lai', 'sequence': 'additional', 'affiliation': []}]",RETRACTED: Ketotifen loaded solid lipid nanoparticles laden contact lens to manage allergic conjunctivitis,2020,Journal of Drug Delivery Science and Technology,Crossref,,likely_retracted,retracted: ketotifen loaded solid lipid nanoparticles laden contact lens to manage allergic conjunctivitis,journal of drug delivery science and technology,1,RP142,retracted paper(rp),,,,retracted:,RP142-Y,1,retracted:,begin
457,10.1016/j.rcot.2017.06.001,"[{'given': 'X.', 'family': 'Can', 'sequence': 'first', 'affiliation': []}, {'given': 'L.', 'family': 'Mingqin', 'sequence': 'additional', 'affiliation': []}, {'given': 'W.', 'family': 'Chenggong', 'sequence': 'additional', 'affiliation': []}, {'given': 'L.', 'family': 'Kanghua', 'sequence': 'additional', 'affiliation': []}, {'given': 'L.', 'family': 'Hua', 'sequence': 'additional', 'affiliation': []}]",RETRACTED: L‚Äôarri√®re pied apr√®s fracture du calcaneus : une √©tude biom√©canique,2017,Revue de Chirurgie Orthop√©dique et Traumatologique,Crossref,,likely_retracted,retracted: l‚Äôarri√®re pied apr√®s fracture du calcaneus : une √©tude biom√©canique,revue de chirurgie orthop√©dique et traumatologique,1,RP239,retracted paper(rp),,,,retracted:,RP239-Y,1,retracted:,begin
459,10.1016/j.ejphar.2017.11.031,Yunwei Li;Juan Wang;Lili Sun;Shengnan Zhu,RETRACTED: LncRNA myocardial infarction-associated transcript (MIAT) contributed to cardiac hypertrophy by regulating TLR4 via miR-93,2017,European Journal of Pharmacology,PubMed; Crossref,29157986.0,likely_retracted,retracted: lncrna myocardial infarction-associated transcript (miat) contributed to cardiac hypertrophy by regulating tlr4 via mir-93,european journal of pharmacology,1,RP84,retracted paper(rp),,,,retracted:,RP84-Y,1,retracted:,begin
462,10.1016/j.physa.2018.02.164,"[{'given': 'Zaitang', 'family': 'Huang', 'sequence': 'first', 'affiliation': []}, {'given': 'Junfei', 'family': 'Cao', 'sequence': 'additional', 'affiliation': []}, {'given': 'Guangqin', 'family': 'Long', 'sequence': 'additional', 'affiliation': []}]",RETRACTED: Long-time behavior of stochastic multimolecular reaction model,2018,Physica A: Statistical Mechanics and its Applications,Crossref,,likely_retracted,retracted: long-time behavior of stochastic multimolecular reaction model,physica a: statistical mechanics and its applications,1,RP219,retracted paper(rp),,,,retracted:,RP219-Y,1,retracted:,begin
476,10.1111/jcmm.14431,,Retracted: MicroRNA‚Äê224 promotes the sensitivity of osteosarcoma cells to cisplatin by targeting Rac1,2019,Journal of Cellular and Molecular Medicine,Crossref,,likely_retracted,retracted: microrna‚Äê224 promotes the sensitivity of osteosarcoma cells to cisplatin by targeting rac1,journal of cellular and molecular medicine,1,RP140,retraction notice(rn),,,,retracted:,RP140-Y,1,retracted:,begin
480,10.1016/j.cscm.2022.e01208,"[{'given': 'Erniati', 'family': 'Bachtiar', 'sequence': 'first', 'affiliation': []}, {'given': 'Fatmawaty', 'family': 'Rachim', 'sequence': 'additional', 'affiliation': []}, {'given': 'Ritnawati', 'family': 'Makbul', 'sequence': 'additional', 'affiliation': []}, {'given': 'Arbain', 'family': 'Tata', 'sequence': 'additional', 'affiliation': []}, {'given': 'Muhammad', 'family': 'Irfan-Ul-Hassan', 'sequence': 'additional', 'affiliation': []}, {'given': 'Mehmet Serkan', 'family': 'Kƒ±rgƒ±z', 'sequence': 'additional', 'affiliation': []}, {'given': 'Muhammad', 'family': 'Syarif', 'sequence': 'additional', 'affiliation': []}, {'given': 'Andr¬¥e Gustavo', 'family': 'de Sousa Galdino', 'sequence': 'additional', 'affiliation': []}, {'given': 'Anwar', 'family': 'Khitab', 'sequence': 'additional', 'affiliation': []}, {'given': 'Omrane', 'family': 'Benjeddou', 'sequence': 'additional', 'affiliation': []}, {'given': 'Konstantinos G.', 'family': 'Kolovos', 'sequence': 'additional', 'affiliation': []}, {'given': 'Enrique Fernandez', 'family': 'Ledesma', 'sequence': 'additional', 'affiliation': []}, {'given': 'Andi', 'family': 'Yusri', 'sequence': 'additional', 'affiliation': []}, {'given': 'Styliani', 'family': 'Papatzani', 'sequence': 'additional', 'affiliation': []}]","RETRACTED: Monitoring of chloride and Friedel‚Äôs salt, hydration components, and porosity in high-performance concrete",2022,Case Studies in Construction Materials,Crossref,,likely_retracted,"retracted: monitoring of chloride and friedel‚Äôs salt, hydration components, and porosity in high-performance concrete",case studies in construction materials,1,RP38,retracted paper(rp),,,,retracted:,RP38-Y,1,retracted:,begin
481,10.1016/j.powtec.2019.12.036,"[{'given': 'Muhammad Aqeel', 'family': 'Ashraf', 'sequence': 'first', 'affiliation': []}, {'given': 'Zhenling', 'family': 'Liu', 'sequence': 'additional', 'affiliation': []}, {'given': 'Cheng', 'family': 'Li', 'sequence': 'additional', 'affiliation': []}, {'given': 'Yafeng', 'family': 'Yang', 'sequence': 'additional', 'affiliation': []}, {'given': 'David', 'family': 'Ross', 'sequence': 'additional', 'affiliation': []}]",RETRACTED: MRT lattice Boltzmann simulation of free convection in a symmetrical annulus combined with experimental data of TiO2-H2O nanofluid's properties,2020,Powder Technology,Crossref,,likely_retracted,retracted: mrt lattice boltzmann simulation of free convection in a symmetrical annulus combined with experimental data of tio2-h2o nanofluid's properties,powder technology,1,RP225,both_rp_rn,,,,retracted:,RP225-Y,1,retracted:,begin
484,10.1016/j.cortex.2019.02.006,"[{'given': 'Witold X.', 'family': 'Chmielewski', 'sequence': 'first', 'affiliation': []}, {'given': 'Christian', 'family': 'Beste', 'sequence': 'additional', 'affiliation': []}]",RETRACTED: Neurophysiological mechanisms underlying the modulation of cognitive control by simultaneous conflicts,2019,Cortex,Crossref,,likely_retracted,retracted: neurophysiological mechanisms underlying the modulation of cognitive control by simultaneous conflicts,cortex,1,RP62,both_rp_rn,,,,retracted:,RP62-Y,1,retracted:,begin
485,10.1016/j.ijleo.2014.08.036,"[{'given': 'Tao', 'family': 'Li', 'sequence': 'first', 'affiliation': []}, {'given': 'Nan-feng', 'family': 'Xiao', 'sequence': 'additional', 'affiliation': []}]",RETRACTED: Novel heuristic dual-ant clustering algorithm for network intrusion outliers detection,2015,Optik,Crossref,,likely_retracted,retracted: novel heuristic dual-ant clustering algorithm for network intrusion outliers detection,optik,1,RP212,retracted paper(rp),,,,retracted:,RP212-Y,1,retracted:,begin
