Unnamed: 0,DOI,Author,Title,Year,Journal,source,PubMedID,Group,Title_lower,Journal_lower,Count,Label_ID,Label,Malik_Label_Validation,Jodi_Label_Validation,Remark,Retraction_Phrase,Inference Possibility,Inference Number,Retraction_Flag,Retraction_Flag_Pos
51,10.1007/s10516-021-09576-1,"[{'ORCID': 'http://orcid.org/0000-0001-7888-4449', 'authenticated-orcid': False, 'given': 'Ekin', 'family': 'Erkan', 'sequence': 'first', 'affiliation': []}]",RETRACTED ARTICLE: Categorial Inference and Convert Realism: Structuring Ontology Via Nomological Axiomatics,2021,Axiomathes,Crossref,,likely_retracted,retracted article: categorial inference and convert realism: structuring ontology via nomological axiomatics,axiomathes,1,RP21,both_rp_rn,,,,retracted article,RP21-Y,1,retracted article:,begin
52,10.1007/s10353-022-00790-8,"[{'ORCID': 'http://orcid.org/0000-0002-6146-7785', 'authenticated-orcid': False, 'given': 'Nader', 'family': 'El-Sourani', 'sequence': 'first', 'affiliation': []}, {'given': 'Sorin', 'family': 'Miftode', 'sequence': 'additional', 'affiliation': []}, {'given': 'Achim', 'family': 'Troja', 'sequence': 'additional', 'affiliation': []}, {'given': 'Fadl', 'family': 'Alfarawan', 'sequence': 'additional', 'affiliation': []}, {'given': 'Maximilian', 'family': 'Bockhorn', 'sequence': 'additional', 'affiliation': []}]",RETRACTED ARTICLE: Changes in diagnosis and management of anastomotic leakage after esophagectomy for underlying malignancy reduce postoperative mortality and improve patient outcome,2023,European Surgery,Crossref,,likely_retracted,retracted article: changes in diagnosis and management of anastomotic leakage after esophagectomy for underlying malignancy reduce postoperative mortality and improve patient outcome,european surgery,1,RP89,both_rp_rn,,,,retracted article,RP89-Y,1,retracted article:,begin
53,10.1631/jzus.b1200102,"[{'given': 'Hai-hong', 'family': 'Zhang', 'sequence': 'first', 'affiliation': []}, {'given': 'Ai-zhen', 'family': 'Cai', 'sequence': 'additional', 'affiliation': []}, {'given': 'Xue-ming', 'family': 'Wei', 'sequence': 'additional', 'affiliation': []}, {'given': 'Li', 'family': 'Ding', 'sequence': 'additional', 'affiliation': []}, {'given': 'Feng-zhi', 'family': 'Li', 'sequence': 'additional', 'affiliation': []}, {'given': 'Ai-ming', 'family': 'Zheng', 'sequence': 'additional', 'affiliation': []}, {'given': 'Da-jiang', 'family': 'Dai', 'sequence': 'additional', 'affiliation': []}, {'given': 'Rong-rong', 'family': 'Huang', 'sequence': 'additional', 'affiliation': []}, {'given': 'Hou-jun', 'family': 'Cao', 'sequence': 'additional', 'affiliation': []}, {'given': 'Hai-yang', 'family': 'Zhou', 'sequence': 'additional', 'affiliation': []}, {'given': 'Jian-mei', 'family': 'Wang', 'sequence': 'additional', 'affiliation': []}, {'given': 'Xue-jing', 'family': 'Wang', 'sequence': 'additional', 'affiliation': []}, {'given': 'Wei', 'family': 'Shi', 'sequence': 'additional', 'affiliation': []}, {'given': 'Heng', 'family': 'Zhu', 'sequence': 'additional', 'affiliation': []}, {'given': 'Xiao-ying', 'family': 'Yuan', 'sequence': 'additional', 'affiliation': []}, {'given': 'Lin', 'family': 'Chen', 'sequence': 'additional', 'affiliation': []}]",RETRACTED ARTICLE: Characterization of cancer stem-like cells in the side population cells of human gastric cancer cell line MKN-45,2013,Journal of Zhejiang University SCIENCE B,Crossref,,likely_retracted,retracted article: characterization of cancer stem-like cells in the side population cells of human gastric cancer cell line mkn-45,journal of zhejiang university science b,1,RP176,retracted paper(rp),,,,retracted article,RP176-Y,1,retracted article:,begin
54,10.1007/s12144-021-01692-w,"[{'ORCID': 'http://orcid.org/0000-0003-3107-9690', 'authenticated-orcid': False, 'given': 'Qian', 'family': 'Zhang', 'sequence': 'first', 'affiliation': []}, {'given': 'El-Lim', 'family': 'Kim', 'sequence': 'additional', 'affiliation': []}, {'given': 'JingJin', 'family': 'Tian', 'sequence': 'additional', 'affiliation': []}, {'given': 'Yi', 'family': 'Cao', 'sequence': 'additional', 'affiliation': []}]",RETRACTED ARTICLE: Chinese calligraphy practice and aggressive behaviors among children: The role of trait aggression and aggressive motivation,2021,Current Psychology,Crossref,,likely_retracted,retracted article: chinese calligraphy practice and aggressive behaviors among children: the role of trait aggression and aggressive motivation,current psychology,1,RP63,retracted paper(rp),,,,retracted article,RP63-Y,1,retracted article:,begin
57,10.1007/s00222-022-01139-4,"[{'given': 'Xingwang', 'family': 'Xu', 'sequence': 'first', 'affiliation': []}, {'given': 'Jian', 'family': 'Ye', 'sequence': 'additional', 'affiliation': []}]",RETRACTED ARTICLE: Closed three-dimensional vacuum static spaces,2022,Inventiones mathematicae,Crossref,,likely_retracted,retracted article: closed three-dimensional vacuum static spaces,inventiones mathematicae,1,RP130,both_rp_rn,,,,retracted article,RP130-Y,1,retracted article:,begin
59,10.1186/1471-2164-14-s5-s6,"[{'given': 'Babita', 'family': 'Shashni', 'sequence': 'first', 'affiliation': []}, {'given': 'Karun', 'family': 'Sharma', 'sequence': 'additional', 'affiliation': []}, {'given': 'Rumani', 'family': 'Singh', 'sequence': 'additional', 'affiliation': []}, {'given': 'Kishore R', 'family': 'Sakharkar', 'sequence': 'additional', 'affiliation': []}, {'given': 'Sarinder K', 'family': 'Dhillon', 'sequence': 'additional', 'affiliation': []}, {'given': 'Yukio', 'family': 'Nagasaki', 'sequence': 'additional', 'affiliation': []}, {'given': 'Meena K', 'family': 'Sakharkar', 'sequence': 'additional', 'affiliation': []}]",RETRACTED ARTICLE: Coffee component hydroxyl hydroquinone (HHQ) as a putative ligand for PPAR gamma and implications in breast cancer,2013,BMC Genomics,Crossref,,likely_retracted,retracted article: coffee component hydroxyl hydroquinone (hhq) as a putative ligand for ppar gamma and implications in breast cancer,bmc genomics,1,RP32,retracted paper(rp),,,,retracted article,RP32-Y,1,retracted article:,begin
60,10.1007/s10551-021-04890-5,"[{'given': 'Nikolay I.', 'family': 'Dorogov', 'sequence': 'first', 'affiliation': []}, {'given': 'Ivan A.', 'family': 'Kapitonov', 'sequence': 'additional', 'affiliation': []}, {'given': 'Nazygul T.', 'family': 'Batyrova', 'sequence': 'additional', 'affiliation': []}]",RETRACTED ARTICLE: Compliance as a Cost-Effective System of Interaction Between Business and Government,2021,Journal of Business Ethics,Crossref,,likely_retracted,retracted article: compliance as a cost-effective system of interaction between business and government,journal of business ethics,1,RP138,both_rp_rn,,,,retracted article,RP138-Y,1,retracted article:,begin
61,10.1007/s12029-021-00756-1,"[{'given': 'Ayman Fathy', 'family': 'Elsayed', 'sequence': 'first', 'affiliation': []}, {'given': 'Hend Samir', 'family': 'Ali', 'sequence': 'additional', 'affiliation': []}, {'given': 'Hala Ahmed', 'family': 'El-Maghawry', 'sequence': 'additional', 'affiliation': []}, {'given': 'Hesham', 'family': 'Atia', 'sequence': 'additional', 'affiliation': []}, {'ORCID': 'http://orcid.org/0000-0003-2917-4293', 'authenticated-orcid': False, 'given': 'Salem Youssef', 'family': 'Mohamed', 'sequence': 'additional', 'affiliation': []}]",RETRACTED ARTICLE: Compliance of Blood Relatives of Colorectal Cancer Patients to Colorectal Screening Guidelines,2021,Journal of Gastrointestinal Cancer,Crossref,,likely_retracted,retracted article: compliance of blood relatives of colorectal cancer patients to colorectal screening guidelines,journal of gastrointestinal cancer,1,RP153,both_rp_rn,,,,retracted article,RP153-Y,1,retracted article:,begin
63,10.1007/s00432-020-03299-3,"[{'given': 'Jing', 'family': 'Huang', 'sequence': 'first', 'affiliation': []}, {'given': 'Zhou', 'family': 'Li', 'sequence': 'additional', 'affiliation': []}, {'given': 'Lijun', 'family': 'Fu', 'sequence': 'additional', 'affiliation': []}, {'given': 'Dahe', 'family': 'Lin', 'sequence': 'additional', 'affiliation': []}, {'given': 'Chunhua', 'family': 'Wang', 'sequence': 'additional', 'affiliation': []}, {'given': 'Xiumei', 'family': 'Wang', 'sequence': 'additional', 'affiliation': []}, {'given': 'Lifen', 'family': 'Zhang', 'sequence': 'additional', 'affiliation': []}]",RETRACTED ARTICLE: Comprehensive characterization of tumor mutation burden in clear cell renal cell carcinoma based on the three independent cohorts,2020,Journal of Cancer Research and Clinical Oncology,Crossref,,likely_retracted,retracted article: comprehensive characterization of tumor mutation burden in clear cell renal cell carcinoma based on the three independent cohorts,journal of cancer research and clinical oncology,1,RP139,both_rp_rn,,,,retracted article,RP139-Y,1,retracted article:,begin
69,10.1134/s1810232816010100,"[{'given': 'K.', 'family': 'Saravanakumar', 'sequence': 'first', 'affiliation': []}, {'given': 'T. G.', 'family': 'Lavanya', 'sequence': 'additional', 'affiliation': []}, {'given': 'T. R.', 'family': 'Kubendran', 'sequence': 'additional', 'affiliation': []}]","RETRACTED ARTICLE: Density, viscosity and speed of sound of benzaldehyde with benzene at 303.15, 308.15, and 313.15 K",2016,Journal of Engineering Thermophysics,Crossref,,likely_retracted,"retracted article: density, viscosity and speed of sound of benzaldehyde with benzene at 303.15, 308.15, and 313.15 k",journal of engineering thermophysics,1,RP146,retracted paper(rp),,,,retracted article,RP146-Y,1,retracted article:,begin
74,10.1080/03772063.2018.1481771,"[{'given': 'Nuli', 'family': 'Namassivaya', 'sequence': 'first', 'affiliation': [{'name': 'Department of ECE, K L University, Vaddeswaram, India'}]}, {'given': 'Surendra', 'family': 'Pal', 'sequence': 'additional', 'affiliation': [{'name': 'Defence Institute of Advanced Technology, Pune, India'}]}, {'given': 'D. Venkata', 'family': 'Ratnam', 'sequence': 'additional', 'affiliation': [{'name': 'Department of ECE, K L University, Vaddeswaram, India'}]}]",RETRACTED ARTICLE: Design of Software-based Global Navigation Satellite System Receiver for Satellite Applications,2018,IETE Journal of Research,Crossref,,likely_retracted,retracted article: design of software-based global navigation satellite system receiver for satellite applications,iete journal of research,1,RP101,retracted paper(rp),,,,retracted article,RP101-Y,1,retracted article:,begin
78,10.1080/0092623x.2018.1474405,,RETRACTED ARTICLE: Digital Ethnography of Zoophilia ‚Äî A Multinational Mixed-Methods Study,2019,Journal of Sex &amp; Marital Therapy,Crossref,,likely_retracted,retracted article: digital ethnography of zoophilia ‚Äî a multinational mixed-methods study,journal of sex &amp; marital therapy,1,RP166,retraction notice(rn),,,,retracted article,RP166-Y,1,retracted article:,begin
79,10.1007/s10967-020-07240-3,"[{'given': 'Kirsten A.', 'family': 'Adams', 'sequence': 'first', 'affiliation': []}, {'ORCID': 'http://orcid.org/0000-0002-8513-8708', 'authenticated-orcid': False, 'given': 'Samuel S.', 'family': 'Morrison', 'sequence': 'additional', 'affiliation': []}, {'given': 'Denis E.', 'family': 'Cherkasov', 'sequence': 'additional', 'affiliation': []}, {'given': 'Nathalie A.', 'family': 'Wall', 'sequence': 'additional', 'affiliation': []}]",RETRACTED ARTICLE: Direct quantification of iodine in nuclear wastes using DRC-ICP-MS,2020,Journal of Radioanalytical and Nuclear Chemistry,Crossref,,likely_retracted,retracted article: direct quantification of iodine in nuclear wastes using drc-icp-ms,journal of radioanalytical and nuclear chemistry,1,RP164,both_rp_rn,,,,retracted article,RP164-Y,1,retracted article:,begin
80,10.3103/s1063454111040054,"[{'given': 'P. V.', 'family': 'Gracheva', 'sequence': 'first', 'affiliation': []}]",RETRACTED ARTICLE: Discrete optimization method based on grassmannian parameterization in multidimensional dichotomic data structuring,2011,Vestnik St. Petersburg University: Mathematics,Crossref,,likely_retracted,retracted article: discrete optimization method based on grassmannian parameterization in multidimensional dichotomic data structuring,vestnik st. petersburg university: mathematics,1,RP270,retracted paper(rp),,,,retracted article,RP270-Y,1,retracted article:,begin
83,10.1007/s42835-020-00524-4,"[{'ORCID': 'http://orcid.org/0000-0002-8343-7720', 'authenticated-orcid': False, 'given': 'Salman', 'family': 'Salman', 'sequence': 'first', 'affiliation': []}, {'given': 'Ai', 'family': 'Xin', 'sequence': 'additional', 'affiliation': []}]",RETRACTED ARTICLE: Droop Control based Approach for Frequency and Voltage in Hybrid AC/DC Microgrid,2020,Journal of Electrical Engineering &amp; Technology,Crossref,,likely_retracted,retracted article: droop control based approach for frequency and voltage in hybrid ac/dc microgrid,journal of electrical engineering &amp; technology,1,RP143,both_rp_rn,,,,retracted article,RP143-Y,1,retracted article:,begin
85,10.1007/s12217-013-9347-8,"[{'given': 'Balwant', 'family': 'Rai', 'sequence': 'first', 'affiliation': []}, {'given': 'Jasdeep', 'family': 'Kaur', 'sequence': 'additional', 'affiliation': []}, {'given': 'Jack J. W. A.', 'family': 'van Loon', 'sequence': 'additional', 'affiliation': []}, {'given': 'Bernard H.', 'family': 'Foing', 'sequence': 'additional', 'affiliation': []}]",RETRACTED ARTICLE: Effect of Short Duration Simulated Microgravity on Effectiveness of Local Anesthesia,2012,Microgravity Science and Technology,Crossref,,likely_retracted,retracted article: effect of short duration simulated microgravity on effectiveness of local anesthesia,microgravity science and technology,1,RP192,both_rp_rn,,,,retracted article,RP192-Y,1,retracted article:,begin
88,10.1007/s00761-022-01153-4,"[{'given': 'Anne Sophie', 'family': 'Kubasch', 'sequence': 'first', 'affiliation': []}, {'given': 'Nora', 'family': 'Grieb', 'sequence': 'additional', 'affiliation': []}, {'given': 'Alexander', 'family': 'Oeser', 'sequence': 'additional', 'affiliation': []}, {'given': 'Claudia', 'family': 'Haferlach', 'sequence': 'additional', 'affiliation': []}, {'given': 'Uwe', 'family': 'Platzbecker', 'sequence': 'additional', 'affiliation': []}]",RETRACTED ARTICLE: Einsatz von k√ºnstlicher Intelligenz im Management akuter Leuk√§mien,2022,Die Onkologie,Crossref,,likely_retracted,retracted article: einsatz von k√ºnstlicher intelligenz im management akuter leuk√§mien,die onkologie,1,RP69,both_rp_rn,,,,retracted article,RP69-Y,1,retracted article:,begin
90,10.1007/s13246-019-00807-9,"[{'ORCID': 'http://orcid.org/0000-0002-9950-860X', 'authenticated-orcid': False, 'given': 'Shubham', 'family': 'Mittal', 'sequence': 'first', 'affiliation': []}]",RETRACTED ARTICLE: Ensemble of transfer learnt classifiers for recognition of cardiovascular tissues from histological images,2019,Physical and Engineering Sciences in Medicine,Crossref,,likely_retracted,retracted article: ensemble of transfer learnt classifiers for recognition of cardiovascular tissues from histological images,physical and engineering sciences in medicine,1,RP221,both_rp_rn,,,,retracted article,RP221-Y,1,retracted article:,begin
92,10.1007/s10103-007-0499-x,"[{'given': 'Raad Niama', 'family': 'Dayem', 'sequence': 'first', 'affiliation': []}]",RETRACTED ARTICLE: Evaluation of the ablation efficacy and morphology of some hard tissues irradiated with different types and modes of laser,2007,Lasers in Medical Science,Crossref,,likely_retracted,retracted article: evaluation of the ablation efficacy and morphology of some hard tissues irradiated with different types and modes of laser,lasers in medical science,1,RP178,retraction notice(rn),,,,retracted article,RP178-Y,1,retracted article:,begin
96,10.1007/s11664-020-08633-6,"[{'ORCID': 'http://orcid.org/0000-0002-3689-8743', 'authenticated-orcid': False, 'given': 'Fahim', 'family': 'Ullah', 'sequence': 'first', 'affiliation': []}, {'given': 'Sami', 'family': 'Iqbal', 'sequence': 'additional', 'affiliation': []}, {'given': 'Kamran', 'family': 'Hasrat', 'sequence': 'additional', 'affiliation': []}, {'given': 'Tong', 'family': 'Zhang', 'sequence': 'additional', 'affiliation': []}]",RETRACTED ARTICLE: Fabrication of Highly Efficient Random Pyramids on Silicon Substrate by Employing CH3COONa as Texturing Solution for Organic-Silicon Hybrid Solar Cells,2021,Journal of Electronic Materials,Crossref,,likely_retracted,retracted article: fabrication of highly efficient random pyramids on silicon substrate by employing ch3coona as texturing solution for organic-silicon hybrid solar cells,journal of electronic materials,1,RP144,both_rp_rn,,,,retracted article,RP144-Y,1,retracted article:,begin
98,10.1007/s11182-014-0176-z,"[{'given': 'Yongkang', 'family': 'Dong', 'sequence': 'first', 'affiliation': []}, {'given': 'Dexin', 'family': 'Ba', 'sequence': 'additional', 'affiliation': []}, {'given': 'Taofei', 'family': 'Jiang', 'sequence': 'additional', 'affiliation': []}, {'given': 'Dengwang', 'family': 'Zhou', 'sequence': 'additional', 'affiliation': []}, {'given': 'Zhiwei', 'family': 'Lu', 'sequence': 'additional', 'affiliation': []}]",RETRACTED ARTICLE: Fast Brillouin Optical Fiber Sensor for Distributed Dynamic Measurement Based on Differential Double-Pulse,2014,Russian Physics Journal,Crossref,,likely_retracted,retracted article: fast brillouin optical fiber sensor for distributed dynamic measurement based on differential double-pulse,russian physics journal,1,RP241,retracted paper(rp),,,,retracted article,RP241-Y,1,retracted article:,begin
101,10.1007/s00233-015-9763-8,"[{'given': 'A. M.', 'family': 'Aminpour', 'sequence': 'first', 'affiliation': []}, {'given': 'Mehrdad', 'family': 'Seilani', 'sequence': 'additional', 'affiliation': []}]",RETRACTED ARTICLE: Function spaces and compact semigroups associated with oids,2015,Semigroup Forum,Crossref,,likely_retracted,retracted article: function spaces and compact semigroups associated with oids,semigroup forum,1,RP242,both_rp_rn,,,,retracted article,RP242-Y,1,retracted article:,begin
103,10.1007/s41870-019-00404-9,"[{'ORCID': 'http://orcid.org/0000-0002-8466-3316', 'authenticated-orcid': False, 'given': 'Sridhar', 'family': 'Iyer', 'sequence': 'first', 'affiliation': []}]",RETRACTED ARTICLE: Generating optimal solutions for the routing space and spectrum allocation problem in space division multiplexing enabled elastic optical networks,2019,International Journal of Information Technology,Crossref,,likely_retracted,retracted article: generating optimal solutions for the routing space and spectrum allocation problem in space division multiplexing enabled elastic optical networks,international journal of information technology,1,RP118,both_rp_rn,,,,retracted article,RP118-Y,1,retracted article:,begin
105,10.1007/s12597-021-00544-2,"[{'ORCID': 'http://orcid.org/0000-0003-0987-5148', 'authenticated-orcid': False, 'given': 'R.', 'family': 'Manivasagam', 'sequence': 'first', 'affiliation': []}]",RETRACTED ARTICLE: Genetic algorithm for minimizing the fuel consumption,2021,OPSEARCH,Crossref,,likely_retracted,retracted article: genetic algorithm for minimizing the fuel consumption,opsearch,1,RP209,both_rp_rn,,,,retracted article,RP209-Y,1,retracted article:,begin
109,10.1007/s10904-020-01614-6,"[{'given': 'P. B.', 'family': 'Nagore', 'sequence': 'first', 'affiliation': []}, {'given': 'A. J.', 'family': 'Ghoti', 'sequence': 'additional', 'affiliation': []}, {'given': 'A. P.', 'family': 'Salve', 'sequence': 'additional', 'affiliation': []}, {'given': 'K. G.', 'family': 'Mane', 'sequence': 'additional', 'affiliation': []}]",RETRACTED ARTICLE: Green Synthesis of Luminescent Copper Oxide Nanoparticles Using Ginger Lily Leaves Extract,2020,Journal of Inorganic and Organometallic Polymers and Materials,Crossref,,likely_retracted,retracted article: green synthesis of luminescent copper oxide nanoparticles using ginger lily leaves extract,journal of inorganic and organometallic polymers and materials,1,RP156,both_rp_rn,,,,retracted article,RP156-Y,1,retracted article:,begin
112,10.1007/s12224-016-9233-4,"[{'given': 'Chang-Bae', 'family': 'Lee', 'sequence': 'first', 'affiliation': []}, {'given': 'Jung-Hwa', 'family': 'Chun', 'sequence': 'additional', 'affiliation': []}]",RETRACTED ARTICLE: Habitat heterogeneity and climate explain plant diversity patterns along an extensive environmental gradient in the temperate forests of South Korea,2016,Folia Geobotanica,Crossref,,likely_retracted,retracted article: habitat heterogeneity and climate explain plant diversity patterns along an extensive environmental gradient in the temperate forests of south korea,folia geobotanica,1,RP94,both_rp_rn,,,,retracted article,RP94-Y,1,retracted article:,begin
115,10.1007/s00542-019-04435-x,"[{'given': 'A.', 'family': 'Surendar', 'sequence': 'first', 'affiliation': []}, {'given': 'Waluyo', 'family': 'Adi Siswanto', 'sequence': 'additional', 'affiliation': []}, {'given': 'Maryam', 'family': 'Alijani', 'sequence': 'additional', 'affiliation': []}, {'given': 'K.', 'family': 'Alhaifi', 'sequence': 'additional', 'affiliation': []}, {'given': 'Mohammad', 'family': 'Salmani', 'sequence': 'additional', 'affiliation': []}]",RETRACTED ARTICLE: High-G drop effect on the creep-fatigue failure of SAC solder joints in BGA packages,2019,Microsystem Technologies,Crossref,,likely_retracted,retracted article: high-g drop effect on the creep-fatigue failure of sac solder joints in bga packages,microsystem technologies,1,RP195,retracted paper(rp),,,,retracted article,RP195-Y,1,retracted article:,begin
116,10.1007/s42486-021-00063-5,"[{'ORCID': 'http://orcid.org/0000-0002-6167-9884', 'authenticated-orcid': False, 'given': 'Pranjal', 'family': 'Kumar', 'sequence': 'first', 'affiliation': []}, {'given': 'Siddhartha', 'family': 'Chauhan', 'sequence': 'additional', 'affiliation': []}]","RETRACTED ARTICLE: Human activity recognition with deep learning: overview, challenges and possibilities",2021,CCF Transactions on Pervasive Computing and Interaction,Crossref,,likely_retracted,"retracted article: human activity recognition with deep learning: overview, challenges and possibilities",ccf transactions on pervasive computing and interaction,1,RP39,both_rp_rn,,,,retracted article,RP39-Y,1,retracted article:,begin
117,10.1007/s12250-020-00248-9,"[{'given': 'Xuan', 'family': 'Dong', 'sequence': 'first', 'affiliation': []}, {'given': 'Jiasong', 'family': 'Xiong', 'sequence': 'additional', 'affiliation': []}, {'given': 'Chaolin', 'family': 'Huang', 'sequence': 'additional', 'affiliation': []}, {'given': 'Jie', 'family': 'Xiang', 'sequence': 'additional', 'affiliation': []}, {'given': 'Wenjuan', 'family': 'Wu', 'sequence': 'additional', 'affiliation': []}, {'given': 'Nanshan', 'family': 'Chen', 'sequence': 'additional', 'affiliation': []}, {'given': 'Danning', 'family': 'Wen', 'sequence': 'additional', 'affiliation': []}, {'given': 'Chao', 'family': 'Tu', 'sequence': 'additional', 'affiliation': []}, {'given': 'Xueli', 'family': 'Qiao', 'sequence': 'additional', 'affiliation': []}, {'given': 'Liang', 'family': 'Kang', 'sequence': 'additional', 'affiliation': []}, {'given': 'Zhongzi', 'family': 'Yao', 'sequence': 'additional', 'affiliation': []}, {'ORCID': 'http://orcid.org/0000-0002-9277-5705', 'authenticated-orcid': False, 'given': 'Dingyu', 'family': 'Zhang', 'sequence': 'additional', 'affiliation': []}, {'ORCID': 'http://orcid.org/0000-0001-8716-6510', 'authenticated-orcid': False, 'given': 'Quanjiao', 'family': 'Chen', 'sequence': 'additional', 'affiliation': []}]",RETRACTED ARTICLE: Human H9N2 Avian Influenza Infection: Epidemiological and Clinical Characterization of 16 Cases in China,2020,Virologica Sinica,Crossref,,likely_retracted,retracted article: human h9n2 avian influenza infection: epidemiological and clinical characterization of 16 cases in china,virologica sinica,1,RP271,both_rp_rn,,,,retracted article,RP271-Y,1,retracted article:,begin
118,10.1134/s0006297913120031,"[{'given': 'Wei', 'family': 'Wang', 'sequence': 'first', 'affiliation': []}, {'given': 'Haicheng', 'family': 'Yan', 'sequence': 'additional', 'affiliation': []}, {'given': 'Changwu', 'family': 'Dou', 'sequence': 'additional', 'affiliation': []}, {'given': 'Youle', 'family': 'Su', 'sequence': 'additional', 'affiliation': []}]",RETRACTED ARTICLE: Human leptin triggers proliferation of A549 cells via blocking endoplasmic reticulum stress-related apoptosis,2013,Biochemistry (Moscow),Crossref,,likely_retracted,retracted article: human leptin triggers proliferation of a549 cells via blocking endoplasmic reticulum stress-related apoptosis,biochemistry (moscow),1,RP25,retracted paper(rp),,,,retracted article,RP25-Y,1,retracted article:,begin
122,10.1007/s10257-020-00477-1,"[{'ORCID': 'http://orcid.org/0000-0002-4130-2342', 'authenticated-orcid': False, 'given': 'Dongling', 'family': 'Wang', 'sequence': 'first', 'affiliation': []}, {'given': 'Yuming', 'family': 'Zhang', 'sequence': 'additional', 'affiliation': []}]",RETRACTED ARTICLE: Implications for sustainability in supply chain management and the circular economy using machine learning model,2020,Information Systems and e-Business Management,Crossref,,likely_retracted,retracted article: implications for sustainability in supply chain management and the circular economy using machine learning model,information systems and e-business management,1,RP107,both_rp_rn,,,,retracted article,RP107-Y,1,retracted article:,begin
